title,link,date,content
"Penjualan Sepeda Motor Indonesia Desember 2024 Turun 21,34 Persen",https://otomotif.kompas.com/read/2025/01/13/080200115/penjualan-sepeda-motor-indonesia-desember-2024-turun-2134-persen,13 Januari 2025,"JAKARTA, KOMPAS.com – Asosiasi Industri Sepeda Motor Indonesia (AISI) telah merilis angka penjualan sepeda motor domestik Indonesia pada Desember 2024, yang mencatat 403.480 unit. Perolehan ini turun 21,34 persen secara bulanan (month to month/mtm) dibandingkan November 2024 sebanyak 512.942 unit. Bahkan, bila dibandingkan dengan Desember 2023 yang meraih 427.033 unit, maka capaian pada periode yang sama tahun 2024 juga turun 5,5 persen.   Sementara itu, penjualan motor di Indonesia sepanjang Januari-Desember 2024 berhasil membukukan 6.333.310 unit. Perolehan ini meningkat 1,5 persen jika dibandingkan dengan periode yang sama tahun lalu, atau secara tahunan (year on year/yoy) sebanyak 6.236.992 unit. Secara lebih perinci, motor skutik masih mendominasi penjualan pada tahun 2024 dengan komposisi pangsa pasar 90,39 persen terhadap penjualan domestik. Angka ini naik dari periode sebelumnya sebanyak 89,73 persen, atau dengan kata lain, penjualan skutik di Indonesia saat ini telah menembus angka 5.724.678 unit. Sementara itu, Underbone atau motor bebek berkontribusi sebesar 5,40 persen, atau sekitar 341.998 unit sepanjang 2024. Jumlah penjualan motor bebek tercatat mengalami peningkatan dari sebelumnya 5,08 persen atau sekitar 316.839 unit. Adapun motor sport menyumbang penjualan 4,21 persen, atau sekitar 266.632 unit, lebih rendah dibandingkan perolehan tahun lalu sebesar 5,19 persen atau sekitar 323.699 unit.   "
"Pengendara Motor Tabrak Tanda Peringatan Jalan, Satu Tewas, Satu Luka",https://surabaya.kompas.com/read/2025/01/12/152254078/pengendara-motor-tabrak-tanda-peringatan-jalan-satu-tewas-satu-luka,12 Januari 2025,"NGAWI, KOMPAS.com - Satu orang tewas dan satu lainnya terluka dalam kecelakaan tragis yang dialami sepasang kekasih saat mengendarai sepeda motor di ruas jalan Ngawi-Madiun, tepatnya di Desa Budug, Kecamatan Kwadungan, Kabupaten Ngawi, Jawa Timur, Jumat (10/1/2025) malam. Kecelakaan itu dipicu saat sepeda motor yang ditumpangi pasangan kekasih tersebut menabrak tanda peringatan perbaikan jalan yang tidak diberi lampu penerangan. Kasatlantas Polres Ngawi AKP Yuliana Plantika yang dikonfirmasi Sabtu (11/1/2025) menyatakan, korban tewas bernama Della Autia Nirmala (20), warga Desa Jambangan, Kecamatan Paron, Kabupaten Ngawi. Sementara kekasihnya, bernama Khoirul Huda (24), warga Desa Margomulyo, Kecamatan Margomulyo, Kabupaten Bojonegoro, Jawa Timur, mengalami luka-luka. ""Korban tewas di tempat kejadian. Korban meninggal setelah terjatuh dari sepeda motor, lalu masuk kolong mobil dan terseret,"" kata Yuliana. Yuliana mengatakan, petaka itu bermula saat sepeda motor N-Max bernomor polisi AE 3297 JAI yang dikemudikan Khoirul Huda memboncengkan Della melaju dari arah Ngawi menuju Madiun. Nahasnya, saat tiba di lokasi kejadian, Khoirul tidak mengetahui adanya papan berisi rambu perbaikan jalan lantaran tidak diberi penerangan lampu. Kondisi itu menjadikan sepeda motor yang dikemudikan Khoirul menabrak batu pengganjal papan rambu tersebut. Apesnya, Della, sang kekasih yang dibonceng, terjatuh ke jalur kanan jalan. ""Dari arah berlawanan muncul sebuah mobil Daihatsu Sigra bernopol R 1343 LC yang dikemudikan ZA (35). Mobil itu menabrak korban hingga tubuhnya terseret dan masuk ke kolong mobil,"" ucapnya. ""Korban langsung meninggal dunia di lokasi kejadian, sedangkan Khoirul mengalami luka ringan,"" kata Yuliana. Usai kejadian, tim Satlantas Polres Ngawi mengevakuasi jenazah Della ke RSUD Dokter Soeroto, Ngawi, untuk visum. Sementara itu, Khoirul dibawa ke Puskesmas Kwadungan untuk perawatan lebih lanjut. Yuliana menyatakan lampu penerangan jalan di lokasi kejadian sangat minim. Tak hanya itu, tidak ada penerangan lampu pada papan rambu peringatan perbaikan jalan. ""Tidak ada penerangan,"" terangnya. Menurut Yuliana, tim Satlantas Polres Ngawi sementara menyelidiki kasus kecelakaan tersebut. Selain itu, polisi sudah mengamankan sopir dan mobil pengangkut rokok yang menabrak korban hingga meninggal dunia. "
"Diskon Skutik Honda Januari 2025, PCX 160 Tembus Rp 1,9 Juta",https://otomotif.kompas.com/read/2025/01/11/100200715/diskon-skutik-honda-januari-2025-pcx-160-tembus-rp-1-9-juta,11 Januari 2025,"JAKARTA, KOMPAS.com – Memasuki Januari 2025, PT Wahana Makmur Sejati, Main Dealer sepeda motor Honda untuk wilayah Jakarta - Tangerang, kembali memberikan potongan untuk beragam jajaran skutik. Promo spesial bertajuk ‘Awal Baru Bersama Honda’ ini menawarkan berbagai keuntungan menarik bagi konsumen yang berlaku sampai 31 Januari 2025.   Division Head of Sales PT Wahana Makmur Sejati, Olivia Widyasuwita, mengatakan bahwa promo ‘Awal Baru Bersama Honda’ adalah waktu yang tepat untuk melakukan pembelian sepeda motor Honda impian. “Di awal tahun 2025, kami menghadirkan promo pembelian sepeda motor Honda untuk beragam tipe, baik yang ingin melakukan secara tunai maupun kredit,” ujar Olivia dalam keterangan resmi, Jumat (10/1/2025). “Jangan sampai terlewat, karena ini waktu yang tepat untuk segera memiliki sepeda motor Honda impian,” kata dia. Beberapa skutik Honda mendapatkan promo menarik ini. Sebut saja Honda BeAT, PCX 160 model lama, Scoopy model lama, PCX 160 model baru, hingga ADV 160.   - Honda BeAT: total potongan sampai Rp 1.200.000,- untuk pembelian tunai dan kredit plus potongan tenor 3x. - Honda Old PCX 160: total potongan sampai Rp 1.900.000,- untuk pembelian tunai dan kredit plus potongan tenor 4x. - Honda Old Scoopy: total potongan sampai Rp 1.300.000,- untuk pembelian tunai dan kredit plus potongan tenor 3x.   - Honda New PCX 160 (ABS & Roadsync): pembelian tunai dan kredit mendapatkan voucer total sampai dengan Rp 800.000,-. - Honda ADV 160: total potongan sampai Rp 1.800.000,- untuk pembelian tunai dan kredit plus potongan tenor 4x. "
Jumlah Kecelakaan Periode Nataru 2024/2025 Diklaim Turun,https://otomotif.kompas.com/read/2025/01/06/163100315/jumlah-kecelakaan-periode-nataru-2024-2025-diklaim-turun,6 Januari 2025,"JAKARTA, KOMPAS.com - Meski secara keseluruhan penyelenggaraan Nataru 2024/2025 diklaim berjalanan lancar, aman, dan selamat, namun tetap diwarnai dengan adanya insiden kecelakaan lalu lintas. Berdasarkan data Integrated Road Safety Management System (IRMS) Korlantas Polri, kejadian kecelakaan lalu lintas pada pelaksanaan Nataru sepanjang 18 Desember 2024 sampai 5 Januari 2025 sebanyak 3.434 kecelakaan. Dari data, jumlah kecelakaan tersebut mengalami penurunan 13,96 persen dibanding periode Nataru 2023/2024 yang jumlahnya mencapai 3.991 kecelakaan. Menteri Peruhubungan (Menhub) Dudy Purwagandhi berharap, seluruh evaluasi dari pelaksanaan angkutan Nataru 2024/2025 bisa menjadi pembelajaran untuk perbaikan ke depannya.   ""Penyelenggaraan angkutan Nataru tahun ini semoga menjadi pembelajaran sehingga kita lebih siap dalam menghadapi Angkutan Lebaran 2025 pada Maret mendatang,"" ujar Dudy ketika menutup Posko Pusat Angkutan Nataru 2024/2025, Senin (6/1/2025). Lebih lanjut Dudy mengatakan, pihaknya sangat berharap untuk kembali bekerja sama, berkomunikasi, dan mempererat kolaborasi dengan seluruh pihak untuk menghadapi masa Lebaran 2025 yang juga berdekatan dengan Hari Raya Nyepi. Operasi Lilin Sebelumnya, Kepala Korps Lalu Lintas (Kakorlantas) Polri Irjen Pol Aan Suhanan juga menyampaikan data soal penurunan angkat kecelakaan lalu lintas pada masa Nataru 2024/2025.  Berdasarkan data Operasi Lilin dari 21 Desember sampai 2 Januari 2025, kendaraan roda dua menjadi jenis kendaraan yang paling dominan terlibat kecelakaan lalu lintas. Jumlahnya 74 persen atau 3.209 insiden selama operasi. ""Sementara itu, kendaraan roda empat seperti angkutan barang mencatat angka 12 persen, bus 6 persen, dan angkutan penumpang 7 persen,"" ujar Aan dalam keterangan tertulisnya, Kamis (2/1/2025). Aan menjelaskan, total kasus kecelakaan lalu lintas mengalami penurunan sebesar 12 persen atau setara dengan 33 kasus dibandingkan periode Nataru tahun sebelumnya.   Untuk motor, selain mendominasi jumlah kecelakaan juga mencatat angka pelanggaran lalu lintas tertinggi dengan jenis pelanggaran yang paling umum berupa tidak menggunakan helm, melanggar marka jalan, melawan arus, tidak memenuhi kelengkapan kendaraan, hingga membonceng lebih dari satu orang. ""Pelanggaran ini masih didominasi oleh pengendara roda dua, seperti tidak menggunakan helm, pelanggaran marka jalan sebanyak 280.000 kasus, serta boncengan lebih dari satu orang,"" ujarnya. "
Simak Daftar Harga Aki Motor per Januari 2025,https://otomotif.kompas.com/read/2025/01/04/132200715/simak-daftar-harga-aki-motor-per-januari-2025,4 Januari 2025,"JAKARTA, KOMPAS.com - Pada sepeda motor, aki memiliki fungsi yang krusial yakni untuk membantu menghidupkan mesin, dan menyuplai listrik seperti lampu, klakson, speedometer dan lainnya. Jika aki soak, mesin akan sulit dihidupkan menggunakan electric starter. Selain itu, komponen ini juga memiliki fungsi sebagai sumber daya untuk menggerakan starter, serta menyimpan Maka dari itu, untuk memaksimalkan kinerja dan kemampuannya, baterai harus diperiksa secara periodik. Sehingga, komponen kelistrikan ini juga memiliki usia yang panjang. Pada dasarnya, terdapat dua tipe aki yang bisa digunakan pada sepeda motor yakni aki basah dan kering. Jenis aki yang banyak digunakan sepeda motor injeksi saat ini adalah aki kering yang sifatnya bebas perawatan atau yang disebut dengan Maintenance Free (MF). Hal ini lantaran perawatan aki jenis MF lebih mudah dibandingkan dengan tipe aki basah, di mana pengendara wajib melakukan pengecekan level ketinggian aki, jika kurang harus ditambah sampai garis batas maksimal.   Saat ini, banyak aki dari berbagai merek yang dijual di pasaran. Namun, pemilik kendaraan harus berhati-hati, sebab biasanya ditawarkan dengan harga murah, tapi kualitas tidak terjamin. Selain kurang awet, aki tersebut juga bisa berpotensi merusak kelistrikan. Bagi Anda yang sedang berencana membeli aki motor dan mencari daftar harganya, redaksi Kompas.com sudah mengumpulkan harganya berdasarkan situs resmi dan jual beli daring pada Sabtu (4/1/2025). Berikut kisaran harga aki mobil per Januari 2025, yang sudah disiapkan untuk Anda. Daftar motor : Honda BeAT (FI dan Karburator), Honda Scoopy (FI dan Karburator), Honda Vario 110, Honda Genio, Yamaha Mio, Yamaha Fino, Yamaha R15, Suzuki Nex II, Suzuki Address Daftar motor : Honda PCX 150, Honda PCX 160, Honda Vario 150 dan 160, Honda ADV 150, Honda CBR 150R, Yamaha NMAX 155, Yamaha Aerox 155, Yamaha XSR 155, Yamaha R15, Kawasaki KLX 150, Suzuki GSX-R 150, Suzuki GSX-R 250, Kawasaki Ninja 250 Daftar motor : Honda CRF1100L Africa Twin, Honda Forza 750, Honda Gold Wing, Yamaha MT-09, Yamaha Tracer 900, Yamaha XSR 900, Yamaha TMAX 560, Kawasaki Ninja ZX-10R, Kawasaki Z900, Kawasaki Versys 1000, Suzuki V-Strom 1000, Suzuki GSX-R 1000, Ducati Monster 821, Ducati Multistrada 950, BMW R 1200 GS, BMW S 1000 XR  "
Komunitas Sepeda-B2W Indonesia Gelar Last Sunday Ride dan Donasi untuk Air Bersih,https://www.kompas.com/sports/read/2025/01/02/04150038/komunitas-sepeda-b2w-indonesia-gelar-last-sunday-ride-dan-donasi-untuk-air,2 Januari 2025,"KOMPAS.com - Bike to Work (B2W) Indonesia, perkumpulan berbadan hukum pengguna berbagai genre sepeda, bersama dengan 37 komunitas, bersepeda pada akhir tahun yang biasa disebut Last Sunday Ride, Minggu (29/12/2024), membawakan tema busana Eropa. Bersepeda akhir tahun ini digelar di Jakarta dan juga dilaksanakan banyak tempat lainnya di seluruh kota dan kabupaten di Indonesia merayakan akhir tahun dengan bersepeda. Hendro Subroto, Presiden B2W Indonesia periode 2024-2028, bersama dengan sekitar 300 pesepeda turut memeriahkan Last Sunday Ride di Jakarta dengan rute dari Bundaran HI - Jakarta International Velodrome. Sekitar 300 pesepeda komunitas B2W Indonesia bersama-sama mengayuh sepeda dengan busana unik ala bangsawan Eropa. ""B2W Indonesia merayakan Last Sunday Ride untuk bersepeda di akhir tahun yang serempak digelar di berbagai wilayah di Indonesia, termasuk kami yang berada di Jakarta,"" tutur Hendro, Selasa (31/12/2024), dalam keterangan pers yang diterima. ""Ini merupakan hasil kerja bareng banyak komunitas dan niat silaturahmi bersama para pesepeda. Kami bersepeda bareng dari Bundaran Hi menuju Jakarta International Velodrome dan berbusana bangsawan Eropa, sedikit bergaya biar enggak bosan,"" tutur Hendro, Kegiatan Last Sunday Ride di Jakarta yang diikuti sekitar 300 pesepeda penuh gaya menyusuri jalur sepeda sekitar 8,2 km dari Jalan MH Thamrin, Medan Merdeka, Tugu Tani, Matraman, Salemba, Jl. Pramuka, dan Jl. Pemuda hingga sampai di Jakarta International Velodrome. Tidak hanya bersepeda bareng, Hendro menyampaikan Last Sunday Ride menjadi lebih menarik karena turut mengajak publik untuk berdonasi potong rambut untuk program Hair River Filter menyaring air kotor menjadi air bersih dengan menggunakan potongan rambut. Para pesepeda dicukur bersama-sama, lalu rambut yang terkumpul dimanfaatkan sebagai komponen panel Hair River Filter. Inisiatif ini dapat mengurangi pencemaran sungai. Donasi potong rambut ini akan digunakan sebagai penyaring air bersih oleh Cleanaction & Collaborators. Cleanaction menghadirkan pangkas rambut para pesepeda untuk penyiapan panel yang akan diaktivasi para pesepada dengan terjun langsung ke sungai di Hari Air Sedunia pada Maret 2025. Dalam Last Sunday Ride juga ada talkshow dengan topik ""Eksplorasi Ruang Publik Jakarta: Dari Spontan hingga Terencana"" yang diulas Head of Corporate Affairs Jaklingko Indonesia Danish Anisa dan Mobility Planner Architect dan Urban Designer M Kadhan Ruskanda. ""Sejatinya pesepeda juga peduli dengan kelestarian alam. Hamemayu hayuning bawana kanthi nyapeda (menjaga harmoni alam dengan bersepeda). Mendorong upaya hadirnya udara bersih dan air bersih layak konsumsi,"" kata Hendro. Presiden B2W Indonesia juga menyampaikan terima kasih kepada 37 komunitas dan entitas yang telah terlibat hadir dan bergembira bersama merayakan sepedaan akhir tahun. ""Selamat Natal kepada yang merayakan dan Selamat Tahun Baru 2025. Tetap bersepeda, gaya dan bermanfaat bagi sesama dan semesta,"" katanya. "
"Sopir Terios yang Tabrak Sepeda Motor di Bogor Diduga Panik Dikejar ""Debt Collector""",https://megapolitan.kompas.com/read/2024/12/24/14380011/sopir-terios-yang-tabrak-sepeda-motor-di-bogor-diduga-panik-dikejar-debt,24 Desember 2024,"BOGOR, KOMPAS.com - Pengemudi Daihatsu Terios bernomor polisi B 2634 FKD yang menabrak pengendara motor di Jalan Raya Siliwangi, Kecamatan Bogor Selatan, Kota Bogor, diduga panik karena dikejar debt collector. Kasatlantas Polresta Bogor Kota Kompol Ardi Wibowo mengatakan peristiwa bermula ketika mobil Daihatsu Terios melaju dari arah Jalan Pajajaran menuju Jalan Batu Tulis, Selasa (24/12/2024) sekitar pukul 10.00 WIB. “Pihak pengemudi ada kaitannya seperti dikejar mata elang (matel) dengan kepanikannya pengemudi membawa mobil ngebut untuk kabur sampai akhirnya menabrak sepeda motor,” ucap Kasatlantas Polresta Bogor Kota Kompol Ardi Wibowo kepada Kompas.com, Selasa (24/12/2024). Saat melintas di Jalan Raya Siliwangi, pengemudi diduga melaju dengan kecepatan tinggi tanpa memperhatikan kondisi sekitar karena merasa dikejar debt collector. Mobil tersebut kemudian kehilangan kendali dan menabrak sepeda motor Honda Supra Fit, yang mengakibatkan pengendara motor terjatuh dan mengalami luka. “Pengendara (sepeda motor) mengalami luka-luka selanjutnya mendapat perawatan di klinik dekat TKP,” kata Ardi. Diketahui pengemudi hendak pergi ke wilayah Bekasi. “Pengemudi dari Bogor Green Forest mau pulang ke Bekasi,” kata Ardi. Hingga kini, polisi masih menyelidiki kecelakaan tersebut dan belum berhasil mendapatkan keterangan dari pengemudi mobil Terios. “Kami belum dapat keterangan dari pengemudi,” kata Ardi. "
"Video Viral, Pengendara RX-King Dihukum Dengarkan Suara Motor Sendiri",https://otomotif.kompas.com/read/2024/12/19/062200415/video-viral-pengendara-rx-king-dihukum-dengarkan-suara-motor-sendiri,19 Desember 2024,"JAKARTA, KOMPAS.com - Beredar di media sosial video mengenai para pengendara sepeda motor Yamaha RX-King dihukum untuk mendengarkan raungan mesin motor dari knalpot yang memekakkan telinga. Dalam video yang diunggah akun Instagram, Cetul_22 ada sejumlah orang yang berjongkok dan disuruh mendengarkan raungan suara motornya sendiri. ""VIRAL! Pemotor yg Suka Geber2 Knalpot Bising ini diminta mendengarkan suara knalpot mereka sendiri oleh Anggota TNI seperti tampak dalam Video berikut,"" tulis keterangan video dikutip, Kamis (19/12/2024). Video tersebut mendapat banyak reaksi dati netizen. Mayoritas mendukung aksi itu karena banyak yang terganggu dengan suara nyaring knalpot motor apalagi ketika ""digeber-geber"". Menanggapi video tersebut tersebut, Budiyanto, pemerhati masalah transportasi dan hukum, mengatakan, tindakan tersebut terkesan keras, tapi tujuannya untuk mendidik masyarakat. ""Kita negara hukumm apabila ada permasalahan yang berkaitan dengan perbuatan hukum, wajib diselesaikan secara hukum, tidak boleh dengan cara-cara kekerasan,"" kata Budiyanto kepada Kompas.com, Rabu (18/12/2024). ""Banyaknya netizen yang mendukung atas tindakan tersebut mungkin masyarakat sudah gerah melihat tingkah laku pemotor yang menggunakan knalpot sambil menggeber-geber,"" katanya.   ""Tapi sekali lagi, tindakan kekerasan tidak dibenarkan kecuali mungkin masih dalam koridor edukasi atau mendidik misal push up yang penting tidak berlebihan. Tindakan secara berlebihan bisa menimbulkan cedera yang saya kira kurang tepat,"" ujarnya. Budiyanto menilai cara paling tepat agar pengendara motor jera ialah dengan melakukan penyitaan kendaraan yang tertuang dalam PP No 80 tahun 2012 mengenai Tata Cara Pemeriksaan Kendaraan Bermotor Di Jalan Dan Penindakan Pelanggaran Lalu Lintas Dan Angkutan Jalan, Pasal 32 Ayat 6. ""Setelah keputusan dari pengadilan dan kendaraan akan dikembalikan ke pemiliknya perintahkan untuk mengganti knalpot yang standar,"" katanya. ""Untuk mengikat pengendara motor tersebut, pengadilan bisa memerintahkan mereka untuk membuat pernyataan sepihak tidak akan mengulangi perbuatan tersebut,"" kata Budiyanto. "
"Longsor di Wonosobo, Rumah dan 3 Sepeda Motor Tertimbun Material",https://regional.kompas.com/read/2024/12/17/210728378/longsor-di-wonosobo-rumah-dan-3-sepeda-motor-tertimbun-material,17 Desember 2024,"WONOSOBO, KOMPAS.com - Hujan deras dengan intensitas tinggi selama kurang lebih lima jam menyebabkan tanah longsor di Kampung Jembarsari, Kelurahan Kejiwan, Kecamatan Wonosobo, Selasa (17/12/2024) pukul 16.30 WIB. Kejadian ini mengakibatkan tanah urukan serta senderan setinggi sekitar tujuh meter dan panjang sekitar 50 meter longsor. Kepala BPBD Kabupaten Wonosobo, Dudy Wardoyo, mengatakan, longsor tersebut berdampak pada satu rumah huni. Selain itu, tiga sepeda motor turut tertimbun material longsor. ""Tanah longsor menimpa bagian samping rumah milik Bapak Wayanto dan menimbun tiga sepeda motor miliknya di RT 006 RW 002 Kampung Mangli, Kelurahan Kejiwan,"" ujar Dudy Wardoyo, dalam keterangan resminya, pada Selasa. Selain itu, material longsor juga menutup aliran Kali Jembarsari, sehingga air tidak bisa mengalir. Akibat tertutupnya aliran irigasi tersebut, sejumlah rumah terancam terkena luapan irigasi. ""Kali Jembarsari tertutup material longsor, menyebabkan aliran air terhambat dan berisiko meluap ke pemukiman,"" tambah Dudy Wardoyo. Meskipun tidak ada korban jiwa maupun luka dalam kejadian ini, kerugian material diperkirakan mencapai Rp 95.000.000. ""Kerugian cukup signifikan karena tiga sepeda motor tertimbun dan rumah huni terkena longsor,"" ungkap Dudy Wardoyo. Saat ini, tanah yang masih bergerak juga mengancam rumah warga lainnya. Sehingga penghuni rumah sementara diamankan ke tempat yang lebih aman. BPBD Kabupaten Wonosobo telah melakukan berbagai upaya untuk menangani dampak bencana ini, termasuk asesmen, evakuasi warga terdampak ke tempat aman, koordinasi dengan pihak terkait, serta himbauan kepada warga untuk selalu waspada. ""Kami telah mengimbau warga terdampak dan terdekat untuk mencari tempat yang lebih aman guna mengantisipasi longsor susulan,"" kata Dudy Wardoyo. "
"Video Viral, Pemotor Mengantuk Kemudian Tampar Diri Sendiri",https://otomotif.kompas.com/read/2024/12/14/090200015/video-viral-pemotor-mengantuk-kemudian-tampar-diri-sendiri,14 Desember 2024,"JAKARTA, KOMPAS.com – Mengantuk adalah hal yang wajar. Namun, mengantuk saat mengendarai sepeda motor sangat berbahaya. Dengan konsentrasi yang menurun, risiko kecelakaan menjadi semakin tinggi. Pada video yang viral di media sosial memperlihatkan seorang pengendara sepeda motor yang tampak menampar diri sendiri beberapa kali, diduga untuk mengusir rasa kantuk. Dalam video yang diunggal akun Instagram, indoviral8, pengendara tersebut sedang berada di sisi kanan jalan satu arah. Karena jalan sedang macet, dia kemudian melepas helm dan menampar dirinya sendiri. ""Ngantuk saat berkendara seorang driver membangunkan dirinya sendiri????????,"" tulis keterangan video dikutip, Sabtu (14/12/2024). Meski terkesan ekstrem cara tersebut mungkin efektif buat pengendara tersebut. Namun menurut Head of Safety Riding promotion Wahana Agus Sani, ada cara yang lebih ""tidak menyakitkan."" Agus menjelaskan bahwa awal penyebab kantuk karena kelelahan dan kurang oksigen yang salah satunya disebabkan aliran darah tak lancar.    “Cara untuk menghilangkan kantuk yaitu dengan istirahat dan minum air mineral. Kemudian bisa lakukan olah tubuh (pemanasan),” kata Agus kepada Kompas.com, belum lama ini. Agus mengatakan, untuk menyegarkan badan dilakukan bisa dengan melakukan peregangan ringan pada bagian-bagian lutut, tangan, dan bahu agar aliran darah kembali lancar. “Jangan lupa untuk membuka helm agar lebih enak peregangannya. Untuk mencegah ngantuk saat berkendara yaitu melakukan pemanasan sebelum riding dan cukup istirahat,” ucap Agus.  "
Kapan Waktu Tepat Menguras Tangki BBM Sepeda Motor?,https://otomotif.kompas.com/read/2024/12/12/190100215/kapan-waktu-tepat-menguras-tangki-bbm-sepeda-motor-,12 Desember 2024,"JAKARTA, KOMPAS.com – Bagi para pemilik sepeda motor, perawatan rutin menjadi kunci utama agar kendaraan tetap awet dan performanya tetap optimal. Salah satu aspek yang sering terlupakan namun sangat penting adalah menguras tangki bahan bakar minyak (BBM). Walaupun tampak sepele, perawatan tangki memiliki dampak besar terhadap kondisi sepeda motor dalam jangka panjang.   Reza Resdie, Technical Service Division PT Astra Honda Motor, mengatakan, pada dasarnya tidak ada waktu rekomendasi untuk menguras tangki BBM sepeda motor. “Kami tidak ada rekomendasi secara periodik. Tapi sarannya begini, para pengguna diharapkan untuk datang ke bengkel resmi sesuai periodical maintenance yang kami anjurkan dalam setahun,” ujar Reza, kepada Kompas.com belum lama ini. “Buat PCX 160 misalnya dalam setahun tiga kali, di 1.000 Km, 6.000 Km, dan kelipatannya. Tujuannya untuk melihat kondisi motor masih prima atau tidak,” kata dia.  Walaupun demikian, Reza mengatakan, kuras tangki BBM dianjurkan buat motor yang lebih sering diparkir atau jarang dipakai. “Motor yang sudah lama dipakai tapi tidak dikuras tangki bahan bakarnya. Jadi bahan bakarnya sudah mengendap lama dan bisa basi,” kata Reza. “Bahan bakar yang basi itu mempercepat kerusakan fuel pump. Karena kualitasnya akan turun dan dia tidak lagi bisa dipakai sebagai bahan bakar,” ujarnya. "
Pria di Jembrana Ditemukan Tewas Terimpit Motor di Selokan,https://denpasar.kompas.com/read/2024/12/11/095155278/pria-di-jembrana-ditemukan-tewas-terimpit-motor-di-selokan,11 Desember 2024,"KOMPAS.com - Seorang pria ditemukan tewas terimpit sepeda motor di selokan pinggir jalan di Banjar Tengah, Desa Yeh Kuning, Kecamatan Jembrana, Kabupaten Jembrana, Provinsi Bali. Mayat tersebut teridentifikasi sebagai I Putu Partama (37), warga Banjar Tegal Asih, Desa Batuagung. Kapolsek Jembrana, Ipda I Ngurah Agus Dwi Widyatmika, mengungkapkan bahwa mayat korban ditemukan oleh seorang warga setempat, I Ketut Tastra (67), Selasa (10/12/2024) sore sekitar pukul 16.00 Wita. ""Penyebab korban meninggal dunia di lokasi kejadian masih dalam penyelidikan kami,"" ungkapnya melalui pesan singkat pada Rabu (11/12/2024). Menurut keterangan Tastra, saat dalam perjalanan pulang, ia melihat benda berwarna merah yang menghalangi aliran air di selokan. Setelah mendekat untuk memeriksa, ia menemukan sepeda motor matik yang menimpa tubuh manusia. Tastra segera menghubungi Bhabinkamtibmas Desa Yeh Kuning untuk melaporkan penemuan tersebut. Petugas kepolisian yang tiba di lokasi langsung mengamankan tempat kejadian perkara (TKP) dan meminta keterangan dari beberapa warga sekitar. Salah satu saksi, Putu Juniasa (34), menyatakan bahwa ia mendengar suara benturan keras dari arah TKP sekitar pukul 00.30 Wita, namun tidak mendatangi lokasi karena mengira suara tersebut berasal dari orang yang menutup toko. Kapolsek menambahkan, meskipun ada kecurigaan bahwa mayat tersebut adalah korban kecelakaan, pihak kepolisian masih melanjutkan penyelidikan untuk mengungkap penyebab pasti kematian korban. "
