title,link,date,content
"Banyak Kecelakaan, Pengamat Soroti Pengendalian Sepeda Listrik dari Hulu",https://lestari.kompas.com/read/2024/07/31/090000286/banyak-kecelakaan-pengamat-soroti-pengendalian-sepeda-listrik-dari-hulu,31 Juli 2024,"KOMPAS.com - Penggunaan kendaraan listrik, termasuk sepeda listrik, memang memiliki banyak manfaat salah satunya ramah lingkungan. Namun, penggunaan sepeda listrik di Indonesia masih perlu pengaturan lebih ketat. Wakil Ketua Pemberdayaan dan Pengembangan Wilayah Masyarakat Transportasi Indonesia (MTI) Pusat, Djoko Setijowarno menilai, sepeda listrik berisiko menimbulkan kecelakaan di jalan raya. Merujuk dari Kompas.id (21/7/2024), terdapat 647 kecelakaan yang melibatkan sepeda listrik dan anak-anak, sepanjang Januari-Juni 2024. ""Sepeda listrik itu tidak berbunyi dan berkecepatan rendah, apalagi di jalan umum. Jalan nasional tak banyak trotoar. Trotoar yang ada, banyak yang tak cukup buat sepeda,"" ujar Djoko dalam pernyataannya, Selasa (30/7/2024). Terkait hal tersebut, untuk pencegahan, ia mengatakan pentingnya pengendalian aturan dan penggunaan sepeda listrik dari hulu. Akademisi Prodi Teknik Sipil Unika Soegijapranata ini memberikan contoh, saat pembelian dilakukan, pembeli harus diingatkan bahwa kendaraan ini tak boleh dioperasikan di jalan umum. ""Pemberitahuan ini bisa disampaikan pihak dealer. Ada edukasi bagi pembeli,"" ujarnya. Selain edukasi dari pihak penjual, kata dia, Korlantas, Ditlantas, Satlantas, Ditjenhubdat serta Dinas Perhubungan Provinsi dan Kota/Kabupaten setiap daerah perlu melakukan sosialisasi dan mengingatkan secara rutin. ""Pengawasan orangtua terhadap anak-anak harus ditingkatkan. Semua pihak harus berperan, termasuk edukasi di sekolah juga. Keselamatan tak mengenal ini tugas siapa, tetapi tanggung jawab bersama,"" tegas Djoko. Ia menilai, kampanye keselamatan perlu dilakukan rutin dan terus berulang, intens, tidak hanya dilakukan pada saat tertentu. Menurutnya, salah satu cara paling efektif adalah memasukkan materi dalam kurikulum sekolah. ""Dengan begini, anak-anak akan dituntut menerima dan memahami materi keselamatan yang ada. Jangan sampai anak-anak menjadi korban sekaligus pemicu kecelakaan di jalan yang dapat merugikan pengendara lain,"" imbuhnya. Pengaturan soal sepeda listrik tertuang dalam Peraturan Menteri Perhubungan (Permenhub) Nomor PM 45 Tahun 2020 tentang Kendaraan Tertentu dengan Menggunakan Penggerak Motor Listrik.   Adapun kendaraan tertentu yang dimaksud berupa skuter listrik, hoverboard, sepatu roda satu (unicycle), otopet, dan sepeda listrik. Meski sudah ada regulasi yang mengatur penggunaan kendaraan dengan penggerak motor listrik, Djoko menilai banyak orang masih melanggar ketentuan yang berlaku. ""Penyalahgunaan sepeda listrik ini, menunjukkan pemahaman masyarakat yang rendah, diikuti pula dengan penegakan hukum yang masih rendah,"" ujarnya. "
Program Khusus Beli Motor Baru di GIIAS 2024,https://otomotif.kompas.com/read/2024/07/27/132824715/program-khusus-beli-motor-baru-di-giias-2024,27 Juli 2024,"TANGERANG, KOMPAS.com - Pada ajang Gaikindo Indonesia International Auto Show (GIIAS) 2024, Astra Financial mengadakan acara talkshow bertajuk “Cara Enjoy Jalani Hidup dengan Miliki Sepeda Motor Lengkap dengan Proteksi Diri”. Acara bersama rekan-rekan media ini dihadiri oleh Daniel Hartono selaku Chief Marketing Officer (CMO) FIFGROUP, Alkaf Ghozali selaku CMO Astra Life, dan Lim Lizal selaku Chief Executive Officer Moxa. Talkshow ini membahas tentang bagaimana mewujudkan mimpi memiliki kendaraan roda dua dengan mudah sekaligus aman. Acara ini juga sebagai dukungan Astra Financial pada Otoritas Jasa Keuangan (OJK) dalam meningkatkan literasi keuangan untuk mencapai 65 persen dan inklusi keuangan 93 persen pada tahun 2027.   Kolaborasi antara FIFGROUP, Moxa, dan Astra Life bertujuan untuk memberikan pengalaman kepemilikan sepeda motor yang aman, nyaman, dan bebas khawatir bagi setiap konsumen. “FIFGROUP berkomitmen untuk memberikan layanan pembiayaan sepeda motor yang cepat dan mudah selama GIIAS 2024. Proses pengajuan hingga verifikasi hanya membutuhkan waktu 1-2 jam, sehingga konsumen dapat segera memiliki sepeda motor impian mereka.” ujar Daniel Hartono. Selain itu, ada tips untuk mendapatkan pengajuan yang cepat, pertama pastikan semua dokumen lengkap. Kedua, menjaga riwayat kredit agar tetap baik. Ketiga, membuktikan penghasilan tetap dengan menunjukkan slip gaji, surat keterangan kerja, atau bukti penghasilan lainnya.  Keempat, memastikan tempat tinggal jelas, kelima, memerhatikan batasan usia untuk pengajuan cicilan motor, yaitu minimal 21 tahun dan maksimal 60 tahun. Terakhir, memertimbangkan untuk memberikan uang muka yang lebih besar. Selama acara GIIAS 2024, FIFGROUP juga memberikan kesempatan bagi para pengunjung untuk mendapatkan keuntungan maksimal dengan berbagai program menarik. Program menarik ini meliputi, memberikan kesempatan bagi para pengunjung untuk mendapatkan keuntungan maksimal dengan berbagai program menarik. Dengan berbagai promo ini, pengunjung yang mengajukan pembiayaan sepeda motor Honda melalui FIFGROUP di GIIAS 2024 dapat menghemat hingga Rp8,867 juta. Kolaborasi ini menegaskan komitmen Astra Financial untuk memberikan solusi keuangan komprehensif, mulai dari pembiayaan, kemudahan transaksi melalui fintech, hingga perlindungan asuransi. Dengan begitu, masyarakat dapat menikmati hidup dengan sepeda motor impian tanpa rasa khawatir. "
"T Line, Brompton Rangka Titanium Masuk Indonesia, Berapa Harganya?",https://lifestyle.kompas.com/read/2024/07/23/185637420/t-line-brompton-rangka-titanium-masuk-indonesia-berapa-harganya,23 Juli 2024,"KOMPAS.com - Di awal tahun 2022 silam, publik pecinta sepeda lipat Brompton di Indonesia sempat dihebohkan dengan munculnya kreasi anyar Brompton berbahan full titanium. Inovasi ini dihadirkan Brompton setelah melewati riset selama tiga tahun hingga lahirlah tipe T Line -demikian nama varian ini. Selanjutnya, publik di Tanah Air pun hanya bisa menyaksikan keberadaan T Line lewat konten review di media sosial. Pasalnya, produk ini tak langsung masuk ke pasar Indonesia. Baru pada awal pekan ini -berjeda lebih dari dua tahun dari pemberitaan awal- Brompton T-Line akhirnya resmi dipasarkan di Tanah Air. “It’s finally here! Brompton T Line akhirnya dapat diperkenalkan ke Bromptoneers di Indonesia,"" kata Country Manager Brompton Indonesia, Kevin Wijaya, kepada Kompas.com. Dijuluki sebagai produk Brompton paling ringan, Brompton T Line memiliki bobot mulai dari 7,45 kg. Bobot tersebut 37 persen lebih ringan daripada frame besi yang digunakan Brompton pada umumnya. Berat Brompton konvensional berbahan rangka besi berada di antara rentang 11-12 kilogram. Lalu, sebelum T Line, edisi titanium Brompton titanium hanya menyematkan material tersebut pada bagian triangle, dan fork, serta -sempat di masa lalu- pada seatpost, sementara rangka utama tetap menggunakan besi. Pada kreasi T Line ini, rangka utama pun menggunakan material titanium, sementara fork, seatpost, dan handlebar memakai material karbon. Meskipun demikian, Kevin mengklaim, ketahanan rangka Brompton T Line tetap setara dengan sepeda Brompton dengan rangka besi.   Kevin lantas menjelaskan, untuk peluncuran di Indonesia, Brompton juga memperkenalkan T Line dalam opsi 12 percepatan -selain empat percepatan eskternal yang dikenal sebelumnya. Sistem gir 12 percepatan memberikan lebih banyak pilihan gir dan jangkauan lebih luas bagi pengendaranya, dengan tetap memertahankan desain kompak. T Line 12 percepatan menggabungkan hub tiga percepatan internal dengan empat percepatan eksternal. "
Sindikat Penyelundup Ribuan Sepeda Motor ke Afsel Dibongkar di Cianjur,https://bandung.kompas.com/read/2024/07/23/074502278/sindikat-penyelundup-ribuan-sepeda-motor-ke-afsel-dibongkar-di-cianjur,23 Juli 2024,"CIANJUR, KOMPAS.com - Kepolisian Resor Cianjur membongkar sindikat internasional penyelundupan sepeda motor ke Afrika Selatan yang meraup keuntungan miliaran rupiah. Sebelum dibongkar, sindikat ini sudah menyelundupkan ribuan unit kendaraan roda dua ke luar negeri. ""Sudah 1.500 unit sepeda motor diselundupkan ke Afrika Selatan sejak 2022 oleh sindikat internasional ini lewat jalur laut."" Demikian kata Kasat Reskrim Polres Cianjur AKP Tono Listianto kepada Kompas.com, Senin (22/7/2024). Disebutkan, dua anggota sindikat kejahatan ini ditangkap saat tengah berupaya mengirimkan unit dari gudang penyimpanan di daerah Jatinangor, Sumedang, ke Jakarta. ""Saat lewat Cianjur, petugas kita yang sedang melakukan KRD atau kegiatan rutin yang ditingkatkan mencurigai ada mobil pikap yang mengangkut sejumlah unit sepeda motor."" ""Saat diperiksa dokumen dan surat-suratnya ternyata tidak ada,"" ujar dia. Menurut Tono, harga jual per unit barang bukti ini di kisaran Rp 30 juta-Rp 35 juta, dan diperkirakan harganya lebih tinggi saat berhasil diselundupkan di negara tujuan. Sementara, untuk mendapatkan kendaraan, modus sindikat ini adalah berpura-pura mengajukan kredit pembelian ke jasa leasing dengan uang muka Rp 2,5 juta. ""Sekali dua kali bayar cicilan, lalu digelapkan. Makanya, keuntungan yang didapat dari sindikat ini bisa mencapai miliaran rupiah,"" kata dia. Menurut dia, sindikat ini melibatkan banyak pihak sehingga jajarannya masih terus mengembangkan pengungkapan kasus ini. ""Kami masih terus lakukan pendalaman terhadap pihak-pihak yang terlibat, akan kami proses tuntas,"" ujar Tono. Sebelumnya, sebanyak 32 unit sepeda motor jenis matic berbagai merek disita jajaran Kepolisian Resor Cianjur, Jawa Barat, dari tangan DF (36) dan ZM (32). Kedua tersangka diamankan saat hendak mengirimkan puluhan unit kendaraan roda dua itu ke Jakarta untuk diselundupkan ke Afrika Selatan. Tersangka dijerat Undang-Undang fidusia dan KHUPidana pasal berlapis dengan ancaman hukuman penjara maksimal tujuh tahun. "
"Remaja Dilaporkan Hilang di Hutan Mergasari Lumajang, Hanya Sepeda Motornya yang Ditemukan",https://surabaya.kompas.com/read/2024/07/17/072354878/remaja-dilaporkan-hilang-di-hutan-mergasari-lumajang-hanya-sepeda-motornya,17 Juli 2024,"LUMAJANG, KOMPAS.com - Candra Afandi Pratama (17) warga Desa Pagowan, Kecamatan Pasrujambe, Kabupaten Lumajang, Jawa Timur, dilaporkan hilang di hutan Dusun Mergasari, Desa Pasrujambe, Kecamatan Pasrujambe sejak Jumat (12/7/2024). Petugas BPBD Kabupaten Lumajang Nur Cahyo mengatakan, korban meninggalkan rumah dengan menggunakan sepeda motor pada Jumat siang. Namun, sampai larut malam Candra tidak kunjung pulang dan tidak bisa dihubungi oleh keluarga. Pada saat meninggalkan rumah, Candra diketahui mengenakan kaus hitam, sarung hitam, dan songkok bertuliskan NU. Keesokan harinya, sepeda motor berwarna merah yang dikendarai korban ditemukan di sekitar Hutan Mergasari dalam kondisi terparkir di antara pepohonan. ""Diduga korban masuk ke hutan, karena motornya ditemukan warga di sekitar Hutan Mergasari,"" kata Cahyo melalui sambungan telepon, Rabu (17/7/2024). Saat ini, proses pencarian masih terus dilakukan oleh tim gabungan. Petugas SAR Jember diterjunkan untuk mencari korban. ""Belum ketemu, kita masih berupaya, mohon doanya,"" kata dia.  "
"Operasi Patuh Jaya 2024 Resmi Digelar, Incar 14 Jenis Pelanggaran",https://otomotif.kompas.com/read/2024/07/15/081200115/operasi-patuh-jaya-2024-resmi-digelar-incar-14-jenis-pelanggaran,15 Juli 2024,"JAKARTA, KOMPAS.com - Polda Metro Jaya resmi menggelar Operasi Patuh Jaya 2024 mulai hari ini, Senin (15/7/2024). Kegiatan ini akan berlangsung selama 14 hari ke depan, tepatnya hingga 28 Juli 2024. Kepala Bagian (Kabag) Operasional Korlantas Polri Kombes Eddy Djunaedi mengatakan, Operasi Patuh Jaya akan dimulai pada 15 Juli hingga 28 Juli 2024. “Iya betul (akan digelar Operasi Patuh Jaya),” ujar Eddy, Minggu (14/7/2024). Dikutip dari akun Instagram Korlantas Polri NTMC, Operasi yang digelar serentak oleh jajaran polda se-Indonesia ini dilakukan dalam rangka mewujudkan masyarakat yang tertib berlalu lintas. “Operasi Patuh ini bertujuan untuk menurunkan angka pelanggaran kecelakaan lalu lintas, dan angka fatalitas korban kecelakaan, serta meningkatkan kedisiplinan masyarakat dalam berlalu lintas,” tulis unggahan, Korlantas Polri NTMC. Mekanisme Operasi Patuh Jaya 2024 dilakukan melalui dua cara, yakni penilangan dan teguran. Penilangan sendiri tidak dilakukan oleh petugas melainkan melalui tilang elektronik atau ETLE. Pada pelaksanaannya, setidaknya ada 8 pelanggaran yang menjadi target Operasi Patuh Jaya 2024. Berikut daftar pelanggaran yang menjadi incaran: "
"Ada Balap Sepeda ""Sudirman Loop"" Hari Ini, Arus Lalu Lintas di Jalan Sudirman-Thamrin Dialihkan",https://megapolitan.kompas.com/read/2024/07/13/06203141/ada-balap-sepeda-sudirman-loop-hari-ini-arus-lalu-lintas-di-jalan,13 Juli 2024,"JAKARTA, KOMPAS.com - Direktorat Lalu Lintas (Ditlantas) Polda Metro Jaya bakal merekayasa arus lalu lintas imbas adanya balap sepeda “Sudirman Loop”, hari ini, Sabtu (13/7/2024). “Kami akan mensterilkan ruas Jalan Sudirman-Thamrin karena ada balapan sepeda,” kata Direktur Lalu Lintas (Dirlantas) Polda Metro Jaya Kombes (Pol) Latif Usman, Jumat (12/7/2024). Latif menerangkan, penutupan jalan akan berlangsung kurang lebih selama 10 jam, sejak Sabtu dini hari hingga siang hari. Maka dari itu, pihaknya merekayasa arus lalu lintas yang mengarah ke Jalan Sudirman-Thamrin. “Penutupan jalan kami lakukan mulai pukul 03.00-13.00 WIB. Ruas Jalan Sudirman-Thamrin yang disterilkan mulai dari Bundaran Senayan hingga Bundaran Hotel Indonesia (HI),” tutur dia. Selain kendaraan pribadi, bus Transjakarta juga bakal dialihkan rutenya. Bus Transjakarta akan diarahkan melalui jalan lain selama perlombaan berlangsung. “Jalur busway kami sterilkan juga. Jadi untuk sementara waktu Transjakarta tak melewati beberapa halte yang ada di Jalan Sudirman-Thamrin,” terang dia. Latif mengungkapkan, pihaknya akan mengerahkan ribuan personel untuk mengatur arus lalu lintas selama acara berlangsung. Ia berharap masyarakat dapat memaklumi penutupan jalan ini. “Kami mohon maaf jika perlombaan ini mengganggu aktivitas warga,” imbuh dia. Berikut ini skema pengalihan arus lintas imbas adanya balap sepeda Sudirman Loop: 1. Arus lalu lintas dari arah Jalan MH Thamrin yang menuju Jalan Jenderal Sudirman dialihkan ke Jalan Imam Bonjol; 2. Arus lalu lintas dari arah Jalan Imam Bonjol yang menuju Jalan Bundaran HI dan Jalan Pamekasan dialihkan ke Jalan Agus Salim dan arus lalu lintas dari arah Jalan Agus Salim yang menuju Jalan Bundaran HI dan Jalan Pamekasan dialihkan ke Jalan Imam Bonjol; 3. Arus lalu lintas dari arah Jalan Galunggung yang menuju Jalan Jenderal Sudirman dialihkan kembali ke Jalan Galunggung; "
"2 Sepeda Motor Tabrakan di Tajur Bogor, 1 Orang Tewas di Lokasi",https://megapolitan.kompas.com/read/2024/07/11/09264791/2-sepeda-motor-tabrakan-di-tajur-bogor-1-orang-tewas-di-lokasi,11 Juli 2024,"BOGOR, KOPAS.com - MH (26), tewas usai terlibat kecelakaan lalu lintas di Jalan Raya Tajur, Kecamatan Bogor Timur, Kota Bogor, Jawa Barat, Rabu (10/7/2024) malam. Kepala Satuan Lalu Lintas Polresta Bogor Kota Komisaris Polisi Ardi Wibowo mengatakan, kecelakaan itu melibatkan dua kendaraan sepeda motor yang bertabrakan dari arah berlawanan. ""Satu orang meninggal dunia, satu orang luka berat, dan satu orang luka ringan. Untuk korban luka-luka semuanya sudah mendapat perawatan di rumah sakit,"" kata Ardi, dalam keterangannya, Kamis (11/7/2024). Ardi mengungkapkan, dari keterangan yang didapat, peristiwa itu terjadi ketika seorang pengendara sepeda motor bernomor polisi F 2683 CM yang dikemudikan HD (37) tengah melaju dari arah Ciawi menuju Sukasari. Saat sedang menyalip, muncul sepeda motor bernomor polisi F 5427 FHG yang dikemudikan MH dari arah berlawanan. ""Saat menyalip diduga tidak berhati-hati dan melambung ke arah kanan, sehingga masuk ke jalur yang berlawanan lalu menabrak motor dari arah berlawanan,"" sebutnya. ""Saat kejadian MH ini juga sedang membonceng rekannya. Dia (rekannya) luka ringan, sementara MH meninggal di lokasi,"" tuturnya. Sementara, HD mengalami luka berat dan dibawa ke Rumah Sakit Juliana untuk mendapat perawatan. Saat ini kedua kendaraan yang terlibat kecelakaan telah dibawa ke Unit Laka Lantas Polresta Bogor Kota sebagai barang bukti. ""Informasi awal dari anggota untuk pengendara yang meninggal di TKP terindikasi tercium alkohol. Tapi ini masih didalami oleh penyidik dan pemeriksaan saksi-saksi,"" pungkasnya. "
3 Tips Rawat Sepeda Gunung dan Sepeda Balap agar Performa Tetap Maksimal,https://travel.kompas.com/read/2024/07/10/160400727/3-tips-rawat-sepeda-gunung-dan-sepeda-balap-agar-performa-tetap-maksimal,10 Juli 2024,"KOMPAS.com - Pencinta olahraga bersepeda wajib tahu cara merawat kendaraannya agar tetap maksimal saat digunakan. Mengingat rute yang dilewati tidak biasa, khususnya untuk sepeda gunung yang dipakai untuk tur jalur berbatu dan nonaspal. Jarak tempuh sepeda gunung dan sepeda balap juga perlu diperhitungkan. Sekali jalan, sepeda bisa menempuh puluhan hingga ratusan kilometer. Simak tips merawat sepeda gunung dan sepeda balap agar performanya tetap maksimal, seperti dijelaskan Farhan Husein, teknisi Rodalink, berikut ini. Pastikan membeli sepeda dari toko resmi bergaransi. Jadi, kamu bisa mendapatkan layanan service sepeda rutin. Misalnya, perawatan sepeda rutin di Rodalink yang dijelaskan oleh Husein, terdiri dari perawatan standar dan perawatan total. ""Service standar itu meliputi pengecekan rem, perpindahan gigi depan dan belakang, serta semua bagian sepeda,"" ujar Farhan ketika ditemui Kompas.com di Indofest, Sabtu (6/7/2024). Adapun service total, sepeda akan dibongkar dan dibersihkan menyeluruh, sekaligus diperiksa ulang semua bagiannya. Hal dasar yang berefek besar dalam perawatan sepeda adalah pelumas rem. Farhan menuturkan, pelumas rem bisa diberikan sendiri oleh pengguna sepeda.   ""Kalau dari bikers sendiri, bisa memberikan pelumas rem sepeda, tetapi jangan terlalu banyak,"" saran Farhan. Beri pelumas rem secukupnya saja. Sebab, bila berlebihan, tingkat responsif rem akan berkurang dan menimbulkan bunyi mengganggu. Farhan mengatakan, pembersih rantai sepeda seharusnya tersedia di toko resmi tempat membeli sepeda. Cairan ini bisa digunakan di rumah untuk membersihkan rantai sepeda sendiri, tetapi harus mengikuti arahan sesuai petunjuk sepeda masing-masing.  "
"Demi Keselamatan, Kenali Area Terbesar Blind Spot pada Bus dan Truk",https://otomotif.kompas.com/read/2024/07/09/084200215/demi-keselamatan-kenali-area-terbesar-blind-spot-pada-bus-dan-truk,9 Juli 2024,"JAKARTA, KOMPAS.com - Blind spot merupakan kondisi pengemudi tidak bisa kondisi kendaraan lain di sekitarnya. Blind spot tergantung dimensi kendaraan, makin panjang dan lebar maka makin besar blind spot. Karena itu, blind spot paling besar ialah kendaraan besar seperti bus dan truk. Pengemudi mobil dan sepeda motor diimbau untuk menjaga jarak dan tidak terlalu dekat dengan bus dan truk. Jusri Pulubuhu, Training Director Jakarta Defensive Driving Consulting (JDDC), mengatakan, untuk bus dan truk area blind spot paling besar ialah di bagian kiri kendaraan.   “Kalau sopir berada di kanan (Indonesia pakai setir kanan) maka blind spot paling besar ada di sisi kiri. Blind spot dari bagian kiri sejajar seluruh kursi pengemudi hingga ke belakang,” ujar Jusri kepada Kompas.com, Senin (8/7/2024). Untuk itu, kata Jusri, sebaiknya pengemudi mobil atau pengendara motor ketika berada dekat dengan bus atau truk paham bagian-bagian mana yang memiliki titik blind spot besar. “Terus bagaimana agar posisi kita bisa terlihat. Ya akal sehat saja. Jika merasa sudah tidak terlihat kita maka segera mengubah posisi di mana kita dalam posisi aman,” ujar Jusri. “Jangan sudah tidak terlihat, kemudian kita diam. Saat dia (truk) belok habis kita. Itu yang sering terjadi di video saat truk manuver ke kiri, dia (sopir truk) tidak tahu ada orang,” ujarnya.   Jusri mengatakan, di Amerika Serikat blind spot juga dikenal sebagai no zone yang artinya ialah zona kosong tak terlihat. “Perlu diketahui, blind spot ada di enam sisi. Sisi depan dan belakang, samping kanan dan kiri, kemudian sisi atas dan bawah,” kata Jusri. “Sisi bawah itu sering terjadi saat kondisi hujan karena pengaruh dimensi juga karena ada faktor lingkungan di mana ada genangan air yang menutup lubang,” ujarnya. "
"Viral, Video Mobil Memaksakan Pakai Spion Sepeda Motor",https://otomotif.kompas.com/read/2024/07/06/132200315/viral-video-mobil-memaksakan-pakai-spion-sepeda-motor,6 Juli 2024,"SOLO, KOMPAS.com - Penggunaan kaca spion pada kendaraan bermotor merupakan keharusan penting untuk memastikan keamanan dalam berkendara. Namun, beredar video yang memperlihatkan mobil berwarna hitam yang berjalan menggunakan spion sepeda motor. Video yang diunggah oleh akun TikTok @miratunisaa_, menuai banyak komentar mulai dari yang penting fungsinya hingga dugaan jika pengendara tersebut korban kemalingan spion mobil.  “Inget ya gais spion mobil manapun gaada yg murah, salut sama bapaknya mentingin untuk utamakan kebutuhan dirumah, siapa tau dia lagi nabung buat beli spion,” tulis akun @siputkaleng_1.0mt. “Bisa jdi habis kehilangan spion dripada bahaya di jalan beli spion motor dulu kayanya sehat trus bapk yg di mobil,” tulis akun @faatimaah.azzahraa. “Utamakan fungsi bukan gengsi,” tulis @putra jawa. Terlepas dari alasan penggunaan spion sepeda motor pada mobil tersebut, aturan kaca spion kendaraan bermotor baik mobil maupun motor telah diatur dalam Peraturan Pemerintah (PP) Nomor 55 Tahun 2012 Pasal 37. Selain itu, dalam masih dalam PP Nomor 55 Tahun 2012 Pasal 35 huruf b, dijelaskan spion kendaraan harus memenuhi dua persyaratan. “Berjumlah 2 buah atau lebih, dan dibuat dari kaca atau bahan lain yang dipasang pada posisi yang dapat memberikan pandangan ke arah samping dan belakang dengan jelas tanpa mengubah jarak dan bentuk objek yang terlihat,"" tulis peraturan itu. Adapun jenis kaca spion yang dipakai juga tidak bisa sembarangan karena harus bisa membuat objek belakang terlihat jelas. Jika memilih spion aftermarket pastikan yang sesuai standar pabrikan. Maksudnya dari bahan yang dipakai dan harus bisa menangkap citra objek belakang secara luas, sehingga tidak menyulitkan pengendara saat ingin melihat kondisi belakang. "
"Mulai Sering Hujan, Ini Jas Hujan yang Aman untuk Pengendara Motor",https://otomotif.kompas.com/read/2024/07/04/193100915/mulai-sering-hujan-ini-jas-hujan-yang-aman-untuk-pengendara-motor,4 Juli 2024,"JAKARTA, KOMPAS.com - Musim hujan mulai belakangan ini melanda sejumlah wilayah Jakarta. Berkendara pada saat hujan deras tentu mengandung risiko yang lebih besar daripada kondisi terang. Maka dari itu, kesiapan dan kewaspadaan pengemudi terhadap lingkungan berkendara harus diingatkan, terutama bagi pengendara motor. Salah satu yang perlu diperhatikan adalah pemilihan jas hujan yang tepat. Umumnya, ada dua model jas hujan, yaitu jas hujan ponco atau terusan dan jas hujan model setelan. Pemilihan jas hujan cukup penting, sebab bisa mempengaruhi tingkat keselamatan saat berkendara. Pemotor harus memilih jas hujan yang praktis dan tidak mudah tersangkut ke bagian motor, seperti pelek atau rantai motor. Dari sisi keamanan, jas hujan seperti apa yang lebih baik untuk digunakan pengendara motor saat berkendara?   Head of Safety Riding Promotion Wahana Agus Sani mengatakan, jas hujan yang disarankan adalah jas hujan dengan model atasan dan bawahan atau terpisah. “Jas hujan yang disarankan adalah yang model terpisah atasan dan celana, jangan menggunakan model ponco untuk menghindari jas hujan tersangkut ke kendaraan lain,” kata Agus, saat dihubungi Kompas.com, Kamis (4/7/2024). Jas hujan model setelan terpisah lebih aman karena bentuknya menyerupai baju dan celana. Sedangkan jas hujan model ponco lebih lebar sehingga sangat mudah tersangkut di bagian komponen motor. Selain itu. pemilihan warna jas hujan juga penting untuk meminimalisir potensi celaka saat berkendara motor. Seperti menggunakan jas hujan berwarna terang, agar dapat terlihat saat hujan deras oleh kendaraan lain. "
